{
  "$schema": "http://json-schema.org/draft-07/schema#",
  "$id": "https://urpx.org/schemas/test-cases-manifest-1.0.0.json",
  "title": "URPX Test Cases Manifest",
  "description": "Schema for the urpx/test-cases/manifest-all.json (full corpus) and the website-side curated subset at static/data/test-cases/manifest.json. Both share fields.",
  "type": "object",
  "required": [
    "schemaVersion",
    "generator",
    "generatedAt",
    "examples"
  ],
  "properties": {
    "schemaVersion": {
      "type": "string",
      "pattern": "^\\d+\\.\\d+\\.\\d+$",
      "description": "Semantic version of THIS schema."
    },
    "generator": {
      "type": "string"
    },
    "generatedAt": {
      "type": "string",
      "pattern": "^\\d{4}-\\d{2}-\\d{2}T\\d{2}:\\d{2}:\\d{2}Z$"
    },
    "examples": {
      "type": "array",
      "items": {
        "type": "object",
        "required": [
          "id",
          "instanceJsonld",
          "diagramSvg"
        ],
        "properties": {
          "id": {
            "type": "string",
            "pattern": "^[a-z][a-z0-9-]*$"
          },
          "title": {
            "type": "string"
          },
          "description": {
            "type": "string"
          },
          "utility": {
            "type": "string"
          },
          "instanceJsonld": {
            "type": "string"
          },
          "diagramSvg": {
            "type": "string"
          },
          "tariffBookPdf": {
            "type": [
              "string",
              "null"
            ]
          }
        },
        "additionalProperties": false
      }
    }
  },
  "additionalProperties": false
}
