{
  "schemaVersion": "1.0.0",
  "generator": "URPX documentation codegen",
  "generatedAt": "2026-09-15T20:48:33Z",
  "examples": [
    {
      "id": "coned-sc1-rate-i",
      "instanceJsonld": "coned-sc1-rate-i/data/coned-sc1-rate-i-v20260201-resolved.jsonld",
      "diagramSvg": "coned-sc1-rate-i/assets/diagram.svg",
      "tariffBookPdf": null
    },
    {
      "id": "coned-sc1-rate-i-supply-ref",
      "instanceJsonld": "coned-sc1-rate-i-supply-ref/data/coned-sc1-rate-i-v20260201-supply-referenced.jsonld",
      "diagramSvg": "coned-sc1-rate-i-supply-ref/assets/diagram.svg",
      "tariffBookPdf": null
    },
    {
      "id": "pge-e-elec",
      "instanceJsonld": "pge-e-elec/data/urpx-rate-plan_pge_e-elec.jsonld",
      "diagramSvg": "pge-e-elec/assets/diagram.svg",
      "tariffBookPdf": null
    },
    {
      "id": "pge-e-tou-c",
      "instanceJsonld": "pge-e-tou-c/data/urpx-rate-plan_pge_e-tou-c.jsonld",
      "diagramSvg": "pge-e-tou-c/assets/diagram.svg",
      "tariffBookPdf": null
    }
  ]
}
